{
  "$schema": "./crhy-flatpaks.schema.json",
  "schema_version": 1,
  "publisher": {
    "github_owner": "crhy",
    "name": "Spaced Linux",
    "homepage": "https://spacedlinux.com/"
  },
  "remote": {
    "name": "spaced-github",
    "title": "Spaced Linux GitHub Apps",
    "comment": "Verified Flatpak releases maintained for Spaced Linux",
    "description": "Curated Flatpak applications published by the crhy GitHub account and verified before import.",
    "descriptor_url": "https://crhy.github.io/spacedbazaar/spaced-github.flatpakrepo",
    "repository_url": "https://crhy.github.io/spacedbazaar/flatpak-repo/",
    "icon": "https://raw.githubusercontent.com/crhy/spacedbazaar/main/data/icons/SpacedBazaar.svg",
    "default_branch": "stable"
  },
  "policy": {
    "channel": "latest-stable-with-reviewed-pins",
    "require_exactly_one_asset": true,
    "require_github_sha256": true,
    "require_appstream_metadata": true,
    "require_appstream_icon": true,
    "unverified_github_assets": "never-install-automatically"
  },
  "apps": [
    {
      "id": "io.github.crhy.SpacedBazaar",
      "name": "SpacedBazaar",
      "summary": "Discover and install applications",
      "repository": "crhy/spacedbazaar",
      "homepage": "https://github.com/crhy/spacedbazaar",
      "branch": "master",
      "runtime": {
        "id": "org.gnome.Platform",
        "branch": "50",
        "repository": "https://flathub.org/repo/flathub.flatpakrepo"
      },
      "publish": true,
      "assets": [
        {
          "arch": "x86_64",
          "pattern": "SpacedBazaar-x86_64.flatpak"
        }
      ],
      "screenshots": [
        {
          "url": "https://raw.githubusercontent.com/crhy/spacedbazaar/15cb25db24c0bd739887049f680c062ba8d8fbad/screenshots/spaced-bazaar-explore-dark-9.26.1.png",
          "caption": "Explore applications in SpacedBazaar on the Spaced dark desktop",
          "sha256": "257a7a6e14ccc7987b9a8a872131d113c942c628bfc0404cfc4be9c51e6b12bb"
        },
        {
          "url": "https://raw.githubusercontent.com/crhy/spacedbazaar/15cb25db24c0bd739887049f680c062ba8d8fbad/screenshots/spaced-bazaar-search-dark-9.26.1.png",
          "caption": "Search results showing application names in SpacedBazaar",
          "sha256": "548d6663aaaace64044fe14191178f869d27ad29e374d7e5ef9d91840448f715"
        }
      ],
      "release_pin": {
        "tag": "v0.1.12",
        "asset_sha256": {
          "x86_64": "973790f4c6cfac1c49eb61221ddb3f543ec453b36d677e3b6ceb66a00c55523d"
        }
      }
    },
    {
      "id": "io.github.crhy.CardsWithCats",
      "name": "Cards With Cats",
      "summary": "Play classic card games against computer-controlled cats",
      "repository": "crhy/CardsWithCats",
      "homepage": "https://github.com/crhy/CardsWithCats",
      "branch": "master",
      "runtime": {
        "id": "org.freedesktop.Platform",
        "branch": "25.08",
        "repository": "https://flathub.org/repo/flathub.flatpakrepo"
      },
      "publish": true,
      "assets": [
        {
          "arch": "x86_64",
          "pattern": "CardsWithCats-*.flatpak"
        }
      ],
      "screenshots": [
        {
          "url": "https://raw.githubusercontent.com/crhy/CardsWithCats/cb040914f685155e2259047703f58c9c6e4a4d52/screenshots/cards-with-cats-menu.png",
          "caption": "Start a card game against a table of cats",
          "sha256": "c8754140910d449da74f7e2e5075001dd4d17018082e02862a383a8cad6b63b9"
        }
      ]
    },
    {
      "id": "io.github.crhy.BrutalChess",
      "name": "Brutal Chess",
      "summary": "Play 3D chess against a computer opponent",
      "repository": "crhy/brutalchess",
      "homepage": "https://github.com/crhy/brutalchess",
      "branch": "stable",
      "runtime": {
        "id": "org.freedesktop.Platform",
        "branch": "25.08",
        "repository": "https://flathub.org/repo/flathub.flatpakrepo"
      },
      "publish": true,
      "assets": [
        {
          "arch": "x86_64",
          "pattern": "BrutalChess-*.flatpak"
        }
      ],
      "screenshots": [
        {
          "url": "https://raw.githubusercontent.com/crhy/brutalchess/7857f0884d8a7efdada14e3a49df3b636307d971/screenshots/brutalchessshot.png",
          "caption": "A match on the charcoal-gray 3D chess board",
          "sha256": "97551e4cd5c2b8b04ffab19f3f580f24080c3e43d8ca9a0445a94f334a949990"
        }
      ]
    },
    {
      "id": "io.github.crhy.voxa",
      "name": "Voxa",
      "summary": "Your personal voice assistant: dictation and local AI",
      "repository": "crhy/voxa",
      "homepage": "https://github.com/crhy/voxa",
      "branch": "master",
      "runtime": {
        "id": "org.gnome.Platform",
        "branch": "50",
        "repository": "https://flathub.org/repo/flathub.flatpakrepo"
      },
      "publish": true,
      "replaces": [
        "io.github.crhy.voice2textai"
      ],
      "assets": [
        {
          "arch": "x86_64",
          "pattern": "Voxa-*-x86_64.flatpak"
        }
      ],
      "screenshots": [
        {
          "url": "https://raw.githubusercontent.com/crhy/voxa/3dc1a9477ca0a9f62da7d9e05385cbd28dbef6df/docs/screenshots/main-window.png",
          "caption": "Voxa ready to listen, with facial quality, local AI and ACTIVE, PAUSE and OFFLINE controls",
          "sha256": "617f62c6e4b0b6e3e4052d0f0093112941584732a41090a715fcd409f63268be"
        },
        {
          "url": "https://raw.githubusercontent.com/crhy/voxa/3dc1a9477ca0a9f62da7d9e05385cbd28dbef6df/docs/screenshots/characters.png",
          "caption": "Choose from 22 photoreal characters",
          "sha256": "73675dcc4a8a1ac215f6a62c8769eed801220b0f5717d3169d7141c90743c75b"
        },
        {
          "url": "https://raw.githubusercontent.com/crhy/voxa/3dc1a9477ca0a9f62da7d9e05385cbd28dbef6df/docs/screenshots/voxa-hiroshi.png",
          "caption": "Every character speaks with an animated face",
          "sha256": "8c24c3a67de855f4e428169b51278aafe849d3acd6c61dd7aa5f6132c71de8e3"
        }
      ]
    },
    {
      "id": "io.github.crhy.rhYciv",
      "name": "rhYciv",
      "summary": "Build an empire in a turn-based strategy game",
      "repository": "crhy/rhYciv",
      "homepage": "https://github.com/crhy/rhYciv",
      "branch": "master",
      "runtime": {
        "id": "org.freedesktop.Platform",
        "branch": "25.08",
        "repository": "https://flathub.org/repo/flathub.flatpakrepo"
      },
      "publish": true,
      "assets": [
        {
          "arch": "x86_64",
          "pattern": "rhYciv-*-x86_64.flatpak"
        }
      ],
      "screenshots": [
        {
          "url": "https://raw.githubusercontent.com/crhy/spacedbazaar/d8d1fdf2a24944d2b7063a17911336254129f687/screenshots/rhyciv-main-menu-1600.png",
          "caption": "Create or load an empire strategy game in rhYciv",
          "sha256": "ea88207af048fd6952bca2aebc0732cbd80852684b488402f1c090e9a0a85b52"
        }
      ]
    }
  ]
}
